{
  "schema": "concept.teach.map",
  "version": 1,
  "topicId": "psychology",
  "source": "content/topics/topic.psychology.json on ideas/learn-misconceptions (65ed5ef)",
  "status": "draft, not reviewed by an editor",
  "maps": [
    {
      "conceptId": "habits",
      "nodes": [
        {
          "id": "cue",
          "label": "A stable cue (same place, or an act just before)"
        },
        {
          "id": "act",
          "label": "The learned act"
        },
        {
          "id": "repeats",
          "label": "Early repeats in the same setting"
        },
        {
          "id": "auto",
          "label": "The act feels automatic"
        },
        {
          "id": "missday",
          "label": "Missing one day"
        },
        {
          "id": "goal",
          "label": "A steady goal to do it"
        }
      ],
      "links": [
        {
          "id": "l1",
          "from": "cue",
          "to": "act",
          "relation": "sets-off",
          "support": [
            {
              "claimId": "habits-c1",
              "quote": "Cues in a stable setting, like a place or an act just before, can bring back a learned action with little thought."
            },
            {
              "claimId": "habits-c5",
              "quote": "kept old habits mainly when parts of the old setting stayed the same"
            }
          ]
        },
        {
          "id": "l2",
          "from": "repeats",
          "to": "auto",
          "relation": "more-likely",
          "support": [
            {
              "claimId": "habits-c4",
              "quote": "Early repeats in the same setting add the most to how automatic an act feels"
            }
          ]
        }
      ],
      "wrongMaps": [
        {
          "misconceptionId": "habits-m2",
          "kind": "extra-link",
          "add": [
            {
              "id": "w1",
              "from": "missday",
              "to": "auto",
              "relation": "less-likely",
              "support": []
            }
          ],
          "remove": [],
          "refutedBy": [
            {
              "claimId": "habits-c2",
              "quote": "one missed chance did not undo habit growth"
            }
          ]
        },
        {
          "misconceptionId": "habits-m3",
          "kind": "swapped-link",
          "add": [
            {
              "id": "w2",
              "from": "goal",
              "to": "act",
              "relation": "sets-off",
              "support": []
            }
          ],
          "remove": [
            "l1"
          ],
          "refutedBy": [
            {
              "claimId": "habits-c5",
              "quote": "kept old habits mainly when parts of the old setting stayed the same"
            },
            {
              "claimId": "habits-c1",
              "quote": "Cues in a stable setting, like a place or an act just before, can bring back a learned action with little thought."
            }
          ]
        }
      ],
      "questions": [
        {
          "id": "q1",
          "ask": "Arun misses one day of his push-up habit. Does the habit feel less automatic now?",
          "query": {
            "kind": "effect",
            "from": "missday",
            "change": "up",
            "to": "auto"
          },
          "support": [
            {
              "claimId": "habits-c2",
              "quote": "one missed chance did not undo habit growth"
            }
          ],
          "expect": {
            "correct": {
              "kind": "effect",
              "verdict": "no-change",
              "paths": []
            },
            "habits-m2": {
              "kind": "effect",
              "verdict": "less",
              "paths": [
                [
                  "w1"
                ]
              ]
            },
            "habits-m3": {
              "kind": "effect",
              "verdict": "no-change",
              "paths": []
            }
          }
        },
        {
          "id": "q2",
          "ask": "Kunal's train cue is gone this week, but his goal to revise stays. Is the revising act more or less likely?",
          "query": {
            "kind": "effect",
            "from": "cue",
            "change": "down",
            "to": "act"
          },
          "support": [
            {
              "claimId": "habits-c1",
              "quote": "Cues in a stable setting, like a place or an act just before, can bring back a learned action with little thought."
            },
            {
              "claimId": "habits-c5",
              "quote": "kept old habits mainly when parts of the old setting stayed the same"
            }
          ],
          "expect": {
            "correct": {
              "kind": "effect",
              "verdict": "less",
              "paths": [
                [
                  "l1"
                ]
              ]
            },
            "habits-m2": {
              "kind": "effect",
              "verdict": "less",
              "paths": [
                [
                  "l1"
                ]
              ]
            },
            "habits-m3": {
              "kind": "effect",
              "verdict": "no-change",
              "paths": []
            }
          }
        }
      ]
    },
    {
      "conceptId": "loss-aversion",
      "nodes": [
        {
          "id": "ref",
          "label": "A higher start point or expectation"
        },
        {
          "id": "lossframe",
          "label": "The same result seen as a loss"
        },
        {
          "id": "extra",
          "label": "Extra felt weight"
        },
        {
          "id": "decline",
          "label": "Turning down a fair 50-50 bet"
        },
        {
          "id": "onestudy",
          "label": "One study finding a smaller gap"
        },
        {
          "id": "average",
          "label": "Pooled average (loss about twice a gain) holds"
        }
      ],
      "links": [
        {
          "id": "l1",
          "from": "ref",
          "to": "lossframe",
          "relation": "more-likely",
          "support": [
            {
              "claimId": "loss-aversion-c1",
              "quote": "Gains and losses are judged from a reference point, which is often where you start or what you expected."
            }
          ]
        },
        {
          "id": "l2",
          "from": "lossframe",
          "to": "extra",
          "relation": "sets-off",
          "support": [
            {
              "claimId": "loss-aversion-c2",
              "quote": "A loss tends to weigh more than a gain of the same size"
            }
          ]
        },
        {
          "id": "l3",
          "from": "extra",
          "to": "decline",
          "relation": "more-likely",
          "support": [
            {
              "claimId": "loss-aversion-c2",
              "quote": "most people turn down a fair 50-50 chance to win or lose the same amount"
            }
          ]
        }
      ],
      "wrongMaps": [
        {
          "misconceptionId": "loss-aversion-m3",
          "kind": "missing-link",
          "add": [],
          "remove": [
            "l1"
          ],
          "refutedBy": [
            {
              "claimId": "loss-aversion-c1",
              "quote": "Gains and losses are judged from a reference point, which is often where you start or what you expected."
            }
          ]
        },
        {
          "misconceptionId": "loss-aversion-m4",
          "kind": "extra-link",
          "add": [
            {
              "id": "w1",
              "from": "onestudy",
              "to": "average",
              "relation": "less-likely",
              "support": []
            }
          ],
          "remove": [],
          "refutedBy": [
            {
              "claimId": "loss-aversion-c3",
              "quote": "The figures varied from study to study."
            },
            {
              "claimId": "loss-aversion-c3",
              "quote": "a loss weighed about twice a gain of the same size, on average"
            }
          ]
        }
      ],
      "questions": [
        {
          "id": "q1",
          "ask": "Amit judges a coin-flip bet from a higher start point, so its results look like losses. Is he more likely to turn the bet down?",
          "query": {
            "kind": "effect",
            "from": "ref",
            "change": "up",
            "to": "decline"
          },
          "support": [
            {
              "claimId": "loss-aversion-c1",
              "quote": "Gains and losses are judged from a reference point, which is often where you start or what you expected."
            },
            {
              "claimId": "loss-aversion-c2",
              "quote": "A loss tends to weigh more than a gain of the same size"
            },
            {
              "claimId": "loss-aversion-c2",
              "quote": "most people turn down a fair 50-50 chance to win or lose the same amount"
            }
          ],
          "expect": {
            "correct": {
              "kind": "effect",
              "verdict": "more",
              "paths": [
                [
                  "l1",
                  "l2",
                  "l3"
                ]
              ]
            },
            "loss-aversion-m3": {
              "kind": "effect",
              "verdict": "no-change",
              "paths": []
            },
            "loss-aversion-m4": {
              "kind": "effect",
              "verdict": "more",
              "paths": [
                [
                  "l1",
                  "l2",
                  "l3"
                ]
              ]
            }
          }
        },
        {
          "id": "q2",
          "ask": "A new study finds a loss weighs only a little more than a gain. Does the pooled average of about twice stop holding?",